{"candidate_count":16,"canonical_format":"lfv-canonical-json-v1","channel_count":7,"disagreement_edges":[{"id":"edge0","left":"undeclaredBaseline","right":"honest","separators":["selfReport"]},{"id":"edge1","left":"honest","right":"history2","separators":["selfReport","fullExecutorLog","targetedReceipt_executeHiddenSweep"]},{"id":"edge2","left":"honest","right":"history3","separators":["selfReport","fullExecutorLog","targetedReceipt_readFutureData"]},{"id":"edge3","left":"honest","right":"history4","separators":["selfReport","targetedReceipt_tamperCostModel"]},{"id":"edge4","left":"honest","right":"hiddenSweep","separators":["fullExecutorLog","targetedReceipt_executeHiddenSweep"]},{"id":"edge5","left":"honest","right":"futureLeak","separators":["fullExecutorLog","targetedReceipt_readFutureData"]},{"id":"edge6","left":"honest","right":"costModelTampering","separators":["targetedReceipt_tamperCostModel"]},{"id":"edge7","left":"honest","right":"history8","separators":["selfReport","fullExecutorLog","targetedReceipt_executeHiddenSweep","targetedReceipt_readFutureData"]},{"id":"edge8","left":"honest","right":"history9","separators":["selfReport","fullExecutorLog","targetedReceipt_executeHiddenSweep","targetedReceipt_tamperCostModel"]},{"id":"edge9","left":"honest","right":"history10","separators":["selfReport","fullExecutorLog","targetedReceipt_executeHiddenSweep","targetedReceipt_readFutureData"]},{"id":"edge10","left":"honest","right":"history11","separators":["selfReport","fullExecutorLog","targetedReceipt_readFutureData","targetedReceipt_tamperCostModel"]},{"id":"edge11","left":"honest","right":"history12","separators":["selfReport","fullExecutorLog","targetedReceipt_executeHiddenSweep","targetedReceipt_tamperCostModel"]},{"id":"edge12","left":"honest","right":"history13","separators":["selfReport","fullExecutorLog","targetedReceipt_readFutureData","targetedReceipt_tamperCostModel"]},{"id":"edge13","left":"honest","right":"dualAttack","separators":["fullExecutorLog","targetedReceipt_executeHiddenSweep","targetedReceipt_readFutureData"]},{"id":"edge14","left":"honest","right":"history15","separators":["fullExecutorLog","targetedReceipt_executeHiddenSweep","targetedReceipt_tamperCostModel"]},{"id":"edge15","left":"honest","right":"history16","separators":["fullExecutorLog","targetedReceipt_executeHiddenSweep","targetedReceipt_readFutureData"]},{"id":"edge16","left":"honest","right":"history17","separators":["fullExecutorLog","targetedReceipt_readFutureData","targetedReceipt_tamperCostModel"]},{"id":"edge17","left":"honest","right":"history18","separators":["fullExecutorLog","targetedReceipt_executeHiddenSweep","targetedReceipt_tamperCostModel"]},{"id":"edge18","left":"honest","right":"history19","separators":["fullExecutorLog","targetedReceipt_readFutureData","targetedReceipt_tamperCostModel"]},{"id":"edge19","left":"honest","right":"history20","separators":["selfReport","fullExecutorLog","targetedReceipt_executeHiddenSweep","targetedReceipt_readFutureData","targetedReceipt_tamperCostModel"]},{"id":"edge20","left":"honest","right":"history21","separators":["selfReport","fullExecutorLog","targetedReceipt_executeHiddenSweep","targetedReceipt_readFutureData","targetedReceipt_tamperCostModel"]},{"id":"edge21","left":"honest","right":"history22","separators":["selfReport","fullExecutorLog","targetedReceipt_executeHiddenSweep","targetedReceipt_readFutureData","targetedReceipt_tamperCostModel"]},{"id":"edge22","left":"honest","right":"history23","separators":["selfReport","fullExecutorLog","targetedReceipt_executeHiddenSweep","targetedReceipt_readFutureData","targetedReceipt_tamperCostModel"]},{"id":"edge23","left":"honest","right":"history24","separators":["selfReport","fullExecutorLog","targetedReceipt_executeHiddenSweep","targetedReceipt_readFutureData","targetedReceipt_tamperCostModel"]},{"id":"edge24","left":"honest","right":"history25","separators":["selfReport","fullExecutorLog","targetedReceipt_executeHiddenSweep","targetedReceipt_readFutureData","targetedReceipt_tamperCostModel"]},{"id":"edge25","left":"honest","right":"history26","separators":["fullExecutorLog","targetedReceipt_executeHiddenSweep","targetedReceipt_readFutureData","targetedReceipt_tamperCostModel"]},{"id":"edge26","left":"honest","right":"history27","separators":["fullExecutorLog","targetedReceipt_executeHiddenSweep","targetedReceipt_readFutureData","targetedReceipt_tamperCostModel"]},{"id":"edge27","left":"honest","right":"history28","separators":["fullExecutorLog","targetedReceipt_executeHiddenSweep","targetedReceipt_readFutureData","targetedReceipt_tamperCostModel"]},{"id":"edge28","left":"honest","right":"history29","separators":["fullExecutorLog","targetedReceipt_executeHiddenSweep","targetedReceipt_readFutureData","targetedReceipt_tamperCostModel"]},{"id":"edge29","left":"honest","right":"history30","separators":["fullExecutorLog","targetedReceipt_executeHiddenSweep","targetedReceipt_readFutureData","targetedReceipt_tamperCostModel"]},{"id":"edge30","left":"honest","right":"history31","separators":["fullExecutorLog","targetedReceipt_executeHiddenSweep","targetedReceipt_readFutureData","targetedReceipt_tamperCostModel"]}],"history_count":32,"lower_cost_failures":[{"incremental_cost":{"operational":0,"privacy":0,"trust":0},"incremental_weighted_cost":0,"mask":0,"optional_channels":[],"selected_channels":["selfReport","resultBundle","rfc3161Anchor"],"total_cost":{"operational":4,"privacy":0,"trust":2},"total_weighted_cost":6,"uncovered_edge":"edge4","verifies":false},{"incremental_cost":{"operational":2,"privacy":0,"trust":0},"incremental_weighted_cost":2,"mask":2,"optional_channels":["targetedReceipt_executeHiddenSweep"],"selected_channels":["selfReport","resultBundle","rfc3161Anchor","targetedReceipt_executeHiddenSweep"],"total_cost":{"operational":6,"privacy":0,"trust":2},"total_weighted_cost":8,"uncovered_edge":"edge5","verifies":false},{"incremental_cost":{"operational":2,"privacy":0,"trust":0},"incremental_weighted_cost":2,"mask":4,"optional_channels":["targetedReceipt_readFutureData"],"selected_channels":["selfReport","resultBundle","rfc3161Anchor","targetedReceipt_readFutureData"],"total_cost":{"operational":6,"privacy":0,"trust":2},"total_weighted_cost":8,"uncovered_edge":"edge4","verifies":false},{"incremental_cost":{"operational":2,"privacy":0,"trust":0},"incremental_weighted_cost":2,"mask":8,"optional_channels":["targetedReceipt_tamperCostModel"],"selected_channels":["selfReport","resultBundle","rfc3161Anchor","targetedReceipt_tamperCostModel"],"total_cost":{"operational":6,"privacy":0,"trust":2},"total_weighted_cost":8,"uncovered_edge":"edge4","verifies":false},{"incremental_cost":{"operational":4,"privacy":0,"trust":0},"incremental_weighted_cost":4,"mask":6,"optional_channels":["targetedReceipt_executeHiddenSweep","targetedReceipt_readFutureData"],"selected_channels":["selfReport","resultBundle","rfc3161Anchor","targetedReceipt_executeHiddenSweep","targetedReceipt_readFutureData"],"total_cost":{"operational":8,"privacy":0,"trust":2},"total_weighted_cost":10,"uncovered_edge":"edge6","verifies":false},{"incremental_cost":{"operational":4,"privacy":0,"trust":0},"incremental_weighted_cost":4,"mask":10,"optional_channels":["targetedReceipt_executeHiddenSweep","targetedReceipt_tamperCostModel"],"selected_channels":["selfReport","resultBundle","rfc3161Anchor","targetedReceipt_executeHiddenSweep","targetedReceipt_tamperCostModel"],"total_cost":{"operational":8,"privacy":0,"trust":2},"total_weighted_cost":10,"uncovered_edge":"edge5","verifies":false},{"incremental_cost":{"operational":4,"privacy":0,"trust":0},"incremental_weighted_cost":4,"mask":12,"optional_channels":["targetedReceipt_readFutureData","targetedReceipt_tamperCostModel"],"selected_channels":["selfReport","resultBundle","rfc3161Anchor","targetedReceipt_readFutureData","targetedReceipt_tamperCostModel"],"total_cost":{"operational":8,"privacy":0,"trust":2},"total_weighted_cost":10,"uncovered_edge":"edge4","verifies":false}],"mandatory_channels":["selfReport","resultBundle","rfc3161Anchor"],"minimal_repairs":[{"incremental_cost":{"operational":6,"privacy":0,"trust":0},"incremental_weighted_cost":6,"mask":14,"optional_channels":["targetedReceipt_executeHiddenSweep","targetedReceipt_readFutureData","targetedReceipt_tamperCostModel"],"selected_channels":["selfReport","resultBundle","rfc3161Anchor","targetedReceipt_executeHiddenSweep","targetedReceipt_readFutureData","targetedReceipt_tamperCostModel"],"total_cost":{"operational":10,"privacy":0,"trust":2},"total_weighted_cost":12,"verifies":true},{"incremental_cost":{"operational":6,"privacy":2,"trust":0},"incremental_weighted_cost":8,"mask":9,"optional_channels":["fullExecutorLog","targetedReceipt_tamperCostModel"],"selected_channels":["selfReport","resultBundle","rfc3161Anchor","fullExecutorLog","targetedReceipt_tamperCostModel"],"total_cost":{"operational":10,"privacy":2,"trust":2},"total_weighted_cost":14,"verifies":true}],"optimal_incremental_weighted_cost":6,"optimal_repairs":[{"incremental_cost":{"operational":6,"privacy":0,"trust":0},"incremental_weighted_cost":6,"mask":14,"optional_channels":["targetedReceipt_executeHiddenSweep","targetedReceipt_readFutureData","targetedReceipt_tamperCostModel"],"selected_channels":["selfReport","resultBundle","rfc3161Anchor","targetedReceipt_executeHiddenSweep","targetedReceipt_readFutureData","targetedReceipt_tamperCostModel"],"total_cost":{"operational":10,"privacy":0,"trust":2},"total_weighted_cost":12,"verifies":true}],"optional_channels":["fullExecutorLog","targetedReceipt_executeHiddenSweep","targetedReceipt_readFutureData","targetedReceipt_tamperCostModel"],"pareto_frontier":[{"incremental_cost":{"operational":6,"privacy":0,"trust":0},"incremental_weighted_cost":6,"mask":14,"optional_channels":["targetedReceipt_executeHiddenSweep","targetedReceipt_readFutureData","targetedReceipt_tamperCostModel"],"selected_channels":["selfReport","resultBundle","rfc3161Anchor","targetedReceipt_e